<?xml version="1.0" encoding="UTF-8"?><!-- Q -> P, Q |- P -->
<!DOCTYPE ARGUMENTO SYSTEM "formulapro.dtd">
<ARGUMENTO>
    <PREMISSA>
        <CONDICIONAL CONECTIVO="â†’">
            <ANTECEDENTE>
                <LPRED>
                    <PREDICATIVO>Q</PREDICATIVO>
                </LPRED>
            </ANTECEDENTE>
            <CONSEQUENTE>
                <LPRED>
                    <PREDICATIVO>P</PREDICATIVO>
                </LPRED>
            </CONSEQUENTE>
        </CONDICIONAL>
    </PREMISSA>
    <PREMISSA>
        <LPRED>
            <PREDICATIVO>Q</PREDICATIVO>
        </LPRED>
    </PREMISSA>
    <CONCLUSAO>
        <LPRED>
            <PREDICATIVO>P</PREDICATIVO>
        </LPRED>
    </CONCLUSAO>
</ARGUMENTO>
